Reading OpenROAD database at '/foss/designs/kvic_336007_ws25-kvic_ws25_v6/librelane/runs/RUN_2025-12-02_21-25-06/38-openroad-globalrouting/tiny_tonegen.odb'…
Reading library file at '/foss/pdks/gf180mcuD/libs.ref/gf180mcu_fd_sc_mcu7t5v0/lib/gf180mcu_fd_sc_mcu7t5v0__tt_025C_5v00.lib'…
Reading design constraints file at '/foss/designs/kvic_336007_ws25-kvic_ws25_v6/librelane/impl.sdc'…
[INFO] Using clock clk…
[INFO] Setting output delay to: 4
[INFO] Setting input delay to: 4
[INFO] Setting load to: 0.07291
[INFO] Setting clock uncertainty to: 0.25
[INFO] Setting clock transition to: 0.1499999999999999944488848768742172978818416595458984375
[INFO] Setting timing derate to: 5%
[INFO] No information on clock propagation in input SDC file-- propagating all clocks.
[INFO] Setting signal min routing layer to: Metal2 and clock min routing layer to Metal2. 
[INFO] Setting signal max routing layer to: Metal5 and clock max routing layer to Metal5. 
-congestion_iterations 50 -verbose -allow_congestion
[INFO GRT-0020] Min routing layer: Metal2
[INFO GRT-0021] Max routing layer: Metal5
[INFO GRT-0022] Global adjustment: 30%
[INFO GRT-0023] Grid origin: (0, 0)
[INFO GRT-0043] No OR_DEFAULT vias defined.
[INFO GRT-0088] Layer Metal1  Track-Pitch = 0.5600  line-2-Via Pitch: 0.4750
[INFO GRT-0088] Layer Metal2  Track-Pitch = 0.5600  line-2-Via Pitch: 0.5600
[INFO GRT-0088] Layer Metal3  Track-Pitch = 0.5600  line-2-Via Pitch: 0.5600
[INFO GRT-0088] Layer Metal4  Track-Pitch = 0.5600  line-2-Via Pitch: 0.5600
[INFO GRT-0088] Layer Metal5  Track-Pitch = 0.9000  line-2-Via Pitch: 0.8200
[INFO GRT-0019] Found 4 clock nets.
[INFO GRT-0001] Minimum degree: 2
[INFO GRT-0002] Maximum degree: 11
[INFO GRT-0003] Macros: 0
[INFO GRT-0043] No OR_DEFAULT vias defined.
[INFO GRT-0004] Blockages: 0

[INFO GRT-0053] Routing resources analysis:
          Routing      Original      Derated      Resource
Layer     Direction    Resources     Resources    Reduction (%)
---------------------------------------------------------------
Metal1     Horizontal          0             0          0.00%
Metal2     Vertical         3015          1892          37.25%
Metal3     Horizontal       3502          2120          39.46%
Metal4     Vertical         3015          1740          42.29%
Metal5     Horizontal       2105          1278          39.29%
---------------------------------------------------------------

[INFO GRT-0197] Via related to pin nodes: 1122
[INFO GRT-0198] Via related Steiner nodes: 14
[INFO GRT-0199] Via filling finished.
[INFO GRT-0111] Final number of vias: 1376
[INFO GRT-0112] Final usage 3D: 4729

[INFO GRT-0096] Final congestion report:
Layer         Resource        Demand        Usage (%)    Max H / Max V / Total Overflow
---------------------------------------------------------------------------------------
Metal1               0             0            0.00%             0 /  0 /  0
Metal2            1892           284           15.01%             0 /  0 /  0
Metal3            2120           317           14.95%             0 /  0 /  0
Metal4            1740             0            0.00%             0 /  0 /  0
Metal5            1278             0            0.00%             0 /  0 /  0
---------------------------------------------------------------------------------------
Total             7030           601            8.55%             0 /  0 /  0

[INFO GRT-0018] Total wirelength: 8929 um
[INFO GRT-0014] Routed nets: 198
[INFO GRT-0006] Repairing antennas, iteration 1.
[INFO GRT-0043] No OR_DEFAULT vias defined.
[INFO GRT-0012] Found 0 antenna violations.
Placement Analysis
---------------------------------
total displacement          0.0 u
average displacement        0.0 u
max displacement            0.0 u
original HPWL            4797.2 u
legalized HPWL           4935.7 u
delta HPWL                    3 %

[INFO DPL-0020] Mirrored 58 instances
[INFO DPL-0021] HPWL before            4935.7 u
[INFO DPL-0022] HPWL after             4797.2 u
[INFO DPL-0023] HPWL delta               -2.8 %
-congestion_iterations 50 -verbose -allow_congestion
[INFO GRT-0020] Min routing layer: Metal2
[INFO GRT-0021] Max routing layer: Metal5
[INFO GRT-0022] Global adjustment: 30%
[INFO GRT-0023] Grid origin: (0, 0)
[INFO GRT-0043] No OR_DEFAULT vias defined.
[INFO GRT-0088] Layer Metal1  Track-Pitch = 0.5600  line-2-Via Pitch: 0.4750
[INFO GRT-0088] Layer Metal2  Track-Pitch = 0.5600  line-2-Via Pitch: 0.5600
[INFO GRT-0088] Layer Metal3  Track-Pitch = 0.5600  line-2-Via Pitch: 0.5600
[INFO GRT-0088] Layer Metal4  Track-Pitch = 0.5600  line-2-Via Pitch: 0.5600
[INFO GRT-0088] Layer Metal5  Track-Pitch = 0.9000  line-2-Via Pitch: 0.8200
[INFO GRT-0019] Found 4 clock nets.
[INFO GRT-0001] Minimum degree: 2
[INFO GRT-0002] Maximum degree: 11
[INFO GRT-0003] Macros: 0
[INFO GRT-0043] No OR_DEFAULT vias defined.
[INFO GRT-0004] Blockages: 0

[INFO GRT-0053] Routing resources analysis:
          Routing      Original      Derated      Resource
Layer     Direction    Resources     Resources    Reduction (%)
---------------------------------------------------------------
Metal1     Horizontal          0             0          0.00%
Metal2     Vertical         3015          1892          37.25%
Metal3     Horizontal       3502          2120          39.46%
Metal4     Vertical         3015          1740          42.29%
Metal5     Horizontal       2105          1278          39.29%
---------------------------------------------------------------

[INFO GRT-0197] Via related to pin nodes: 1122
[INFO GRT-0198] Via related Steiner nodes: 14
[INFO GRT-0199] Via filling finished.
[INFO GRT-0111] Final number of vias: 1376
[INFO GRT-0112] Final usage 3D: 4729

[INFO GRT-0096] Final congestion report:
Layer         Resource        Demand        Usage (%)    Max H / Max V / Total Overflow
---------------------------------------------------------------------------------------
Metal1               0             0            0.00%             0 /  0 /  0
Metal2            1892           284           15.01%             0 /  0 /  0
Metal3            2120           317           14.95%             0 /  0 /  0
Metal4            1740             0            0.00%             0 /  0 /  0
Metal5            1278             0            0.00%             0 /  0 /  0
---------------------------------------------------------------------------------------
Total             7030           601            8.55%             0 /  0 /  0

[INFO GRT-0018] Total wirelength: 8929 um
[INFO GRT-0014] Routed nets: 198
[INFO] Setting RC values…
Setting global connections for newly added cells…
[INFO] Setting global connections...
Updating metrics…
Cell type report:                       Count       Area
  Endcap cell                              46     201.96
  Tap cell                                 87     381.96
  Tie cell                                  3      26.34
  Clock buffer                              4     346.84
  Timing Repair Buffer                     22     381.96
  Inverter                                 16     144.88
  Sequential cell                          51    3611.10
  Multi-Input combinational cell           92    2089.83
  Total                                   321    7184.89
Writing OpenROAD database to '/foss/designs/kvic_336007_ws25-kvic_ws25_v6/librelane/runs/RUN_2025-12-02_21-25-06/41-openroad-repairantennas/1-diodeinsertion/tiny_tonegen.odb'…
Writing layout to '/foss/designs/kvic_336007_ws25-kvic_ws25_v6/librelane/runs/RUN_2025-12-02_21-25-06/41-openroad-repairantennas/1-diodeinsertion/tiny_tonegen.def'…
